{
  "schema_version": "1.0",
  "id": "payroll-no-malware",
  "title": "Compromise the payroll server without malware",
  "description": "A controlled identity-led path from a simulated phishing interaction to payroll-record access, with no payload, destructive action, or real infrastructure activity.",
  "seed": 20260712,
  "start_time": "2026-07-12T09:30:00Z",
  "objective": {
    "kind": "compromise_asset",
    "target_role": "payroll-server",
    "description": "Obtain simulated access to the payroll server and read synthetic payroll records."
  },
  "constraints": {
    "max_duration_seconds": 1800,
    "max_steps": 8,
    "min_techniques": 6,
    "required_techniques": [
      "T1566.002",
      "T1539",
      "T1078",
      "T1046",
      "T1021.004",
      "T1005"
    ],
    "allowed_primitives": [
      "social.spearphishing_link",
      "credential.session_cookie",
      "identity.valid_account",
      "discovery.network_services",
      "lateral.ssh_valid_account",
      "collection.local_records"
    ],
    "forbidden_capabilities": [
      "malware",
      "arbitrary_execution",
      "destructive",
      "real_network",
      "secret_access"
    ],
    "required_telemetry_sources": [
      "email_gateway",
      "identity",
      "network",
      "linux_audit",
      "application_audit",
      "siem"
    ]
  },
  "topology": {
    "profile": "mixed-enterprise-small",
    "required_roles": ["payroll-server"],
    "user_count": 12
  },
  "detection_criteria": [
    {
      "id": "identity-chain",
      "title": "Phishing interaction followed by anomalous authentication",
      "ordered_event_types": [
        "message_delivered",
        "link_opened",
        "browser_session_access",
        "authentication_success"
      ],
      "required_sources": ["email_gateway", "web_proxy", "endpoint", "identity"],
      "max_span_seconds": 600,
      "minimum_matching_events": 4
    },
    {
      "id": "payroll-access-chain",
      "title": "Service discovery followed by remote access and payroll reads",
      "ordered_event_types": ["service_probe", "remote_login", "sensitive_records_read"],
      "required_sources": ["network", "linux_audit", "application_audit"],
      "max_span_seconds": 600,
      "minimum_matching_events": 3
    },
    {
      "id": "bulk-read-correlation",
      "title": "Sensitive application read correlated by the SIEM",
      "ordered_event_types": ["sensitive_records_read", "bulk_read_signal"],
      "required_sources": ["application_audit", "siem"],
      "max_span_seconds": 120,
      "minimum_matching_events": 2
    }
  ],
  "expected_results": [
    {
      "id": "objective",
      "title": "Payroll server objective reached",
      "kind": "objective_reached",
      "value": true
    },
    {
      "id": "technique-depth",
      "title": "At least six distinct techniques are represented",
      "kind": "minimum_techniques",
      "value": 6
    },
    {
      "id": "duration",
      "title": "Scenario stays within the thirty-minute limit",
      "kind": "duration_at_most",
      "value": 1800
    },
    {
      "id": "siem-signal",
      "title": "A SIEM event is available to the analyst",
      "kind": "telemetry_source_present",
      "value": "siem"
    },
    {
      "id": "malware-absent",
      "title": "No malware capability is present",
      "kind": "forbidden_capability_absent",
      "value": "malware"
    }
  ],
  "analyst_questions": [
    {
      "id": "q-initial-access",
      "prompt": "Which evidence links the initial social interaction to the new identity session?",
      "evidence_hints": ["message_delivered", "link_opened", "session_anomaly", "new_session"]
    },
    {
      "id": "q-pivot",
      "prompt": "What is the first event proving movement from identity access toward the payroll host?",
      "evidence_hints": ["service_probe", "remote_service_connection", "remote_login"]
    },
    {
      "id": "q-impact",
      "prompt": "Which correlated signals establish that sensitive payroll data was accessed?",
      "evidence_hints": ["sensitive_records_read", "bulk_read_signal"]
    },
    {
      "id": "q-containment",
      "prompt": "Which identity and network controls would interrupt the chain with the least business impact?",
      "evidence_hints": ["authentication_success", "new_session", "connection_allowed"]
    }
  ]
}
